{"canonical":"(0:Café-0[(2037:Café-insert-2037[(3052:edit\\:\\[\\]\\(\\)\\\\-insert-3052[(1134:مرحبا-insert-1134[(3436:edit\\:\\[\\]\\(\\)\\\\-insert-3436[(3449:資料-insert-3449[(3531:🚀-insert-3531[])])])(3559:🚀-insert-3559[])])(3253:naïve-insert-3253[(3258:資料-insert-3258[(2067:Café-insert-2067[(2751:🚀-insert-2751[(3068:資料-insert-3068[(3492:Café-insert-3492[(3558:Café-insert-3558[])(3388:مرحبا-insert-3388[(2361:東京-insert-2361[(3517:資料-insert-3517[(2268:東京-insert-2268[(3202:edit\\:\\[\\]\\(\\)\\\\-insert-3202[])(3298:Café-insert-3298[(3302:مرحبا-insert-3302[(3426:Café-insert-3426[(3582:مرحبا-insert-3582[])])])(1911:edit\\:\\[\\]\\(\\)\\\\-insert-1911[(2977:naïve-insert-2977[(2708:🚀-insert-2708[(3493:東京-insert-3493[(3502:नमस्ते-insert-3502[])])])(1598:مرحبا-insert-1598[])(3282:東京-insert-3282[(3577:東京-insert-3577[])])(3508:edit\\:\\[\\]\\(\\)\\\\-insert-3508[])(3435:資料-insert-3435[(3406:مرحبا-insert-3406[])])])])])])(3568:資料-insert-3568[(3576:🚀-insert-3576[])])])(3324:naïve-insert-3324[(3395:नमस्ते-insert-3395[])])(3526:🚀-insert-3526[])])])])])(3564:naïve-insert-3564[])])(3115:edit\\:\\[\\]\\(\\)\\\\-insert-3115[(3321:مرحبا-insert-3321[(3022:資料-insert-3022[(3557:Café-insert-3557[])])(3050:資料-insert-3050[])(3310:🚀-insert-3310[(3371:مرحبا-insert-3371[(3397:Café-insert-3397[])])(3512:naïve-insert-3512[])])(3466:Café-insert-3466[])])(3570:東京-insert-3570[])])])(2719:🚀-insert-2719[])])])])(2241:مرحبا-insert-2241[(3553:مرحبا-insert-3553[(3572:🚀-insert-3572[])])])(3379:資料-insert-3379[(2642:naïve-insert-2642[(3578:資料-insert-3578[])(3198:नमस्ते-insert-3198[(3164:naïve-insert-3164[])])(1674:नमस्ते-insert-1674[(3327:नमस्ते-insert-3327[(2170:naïve-insert-2170[(3567:naïve-insert-3567[])(3433:🚀-insert-3433[])])(3579:edit\\:\\[\\]\\(\\)\\\\-insert-3579[])])])(3377:naïve-insert-3377[(3472:edit\\:\\[\\]\\(\\)\\\\-insert-3472[(3506:مرحبا-insert-3506[])])(902:नमस्ते-insert-902[(3432:🚀-insert-3432[(3473:edit\\:\\[\\]\\(\\)\\\\-insert-3473[])(3387:Café-insert-3387[(3552:edit\\:\\[\\]\\(\\)\\\\-insert-3552[])(3514:مرحبا-insert-3514[(3090:नमस्ते-insert-3090[(3008:🚀-insert-3008[(3159:edit\\:\\[\\]\\(\\)\\\\-insert-3159[(3334:東京-insert-3334[(3443:नमस्ते-insert-3443[(3384:naïve-insert-3384[(3370:naïve-insert-3370[(3009:資料-insert-3009[(2164:Café-insert-2164[(2353:🚀-insert-2353[(2489:नमस्ते-insert-2489[])])(2339:नमस्ते-insert-2339[(2657:naïve-insert-2657[(3132:資料-insert-3132[(3187:東京-insert-3187[(3402:naïve-insert-3402[(3521:नमस्ते-insert-3521[])])])(2854:東京-insert-2854[(2983:naïve-insert-2983[])(3421:Café-insert-3421[(3496:नमस्ते-insert-3496[(3400:edit\\:\\[\\]\\(\\)\\\\-insert-3400[(3529:東京-insert-3529[(3588:مرحبا-insert-3588[])])(2711:مرحبا-insert-2711[])])])])(3254:naïve-insert-3254[(3264:नमस्ते-insert-3264[(3500:edit\\:\\[\\]\\(\\)\\\\-insert-3500[(3450:東京-insert-3450[])(3451:資料-insert-3451[])])])(3221:naïve-insert-3221[])])])(3488:naïve-insert-3488[(3550:naïve-insert-3550[(3560:naïve-insert-3560[])(1994:資料-insert-1994[(3569:Café-insert-3569[(2844:🚀-insert-2844[(3167:नमस्ते-insert-3167[(2974:नमस्ते-insert-2974[(3125:東京-insert-3125[])(2756:naïve-insert-2756[])(3087:edit\\:\\[\\]\\(\\)\\\\-insert-3087[(3195:edit\\:\\[\\]\\(\\)\\\\-insert-3195[])])(2939:Café-insert-2939[(3477:東京-insert-3477[])(2626:مرحبا-insert-2626[])(3527:مرحبا-insert-3527[])])])(2798:東京-insert-2798[(3562:नमस्ते-insert-3562[])(2891:नमस्ते-insert-2891[(3563:नमस्ते-insert-3563[])(3366:مرحبا-insert-3366[(3478:🚀-insert-3478[(3442:🚀-insert-3442[(2851:naïve-insert-2851[(3536:🚀-insert-3536[])(3251:edit\\:\\[\\]\\(\\)\\\\-insert-3251[(3513:edit\\:\\[\\]\\(\\)\\\\-insert-3513[])(1609:Café-insert-1609[(3119:مرحبا-insert-3119[(3463:資料-insert-3463[])])(2704:naïve-insert-2704[(3539:naïve-insert-3539[])(2681:🚀-insert-2681[])])(3575:🚀-insert-3575[])])])])])(3152:مرحبا-insert-3152[])])(3416:資料-insert-3416[])])(3333:नमस्ते-insert-3333[])])])])(3281:edit\\:\\[\\]\\(\\)\\\\-insert-3281[(2238:東京-insert-2238[(2093:資料-insert-2093[])])])])])])])(3534:नमस्ते-insert-3534[])])])])(2816:नमस्ते-insert-2816[(3185:資料-insert-3185[(3498:Café-insert-3498[])(3217:नमस्ते-insert-3217[(3293:資料-insert-3293[(3581:Café-insert-3581[])(3160:naïve-insert-3160[(3543:naïve-insert-3543[])])(3224:資料-insert-3224[(3589:edit\\:\\[\\]\\(\\)\\\\-insert-3589[])(3587:naïve-insert-3587[])])(2880:مرحبا-insert-2880[(2582:edit\\:\\[\\]\\(\\)\\\\-insert-2582[(2492:edit\\:\\[\\]\\(\\)\\\\-insert-2492[(3541:東京-insert-3541[])])])])])])])])])(2846:नमस्ते-insert-2846[(3170:नमस्ते-insert-3170[(3316:🚀-insert-3316[(3545:مرحبا-insert-3545[])])(3583:Café-insert-3583[])(3294:naïve-insert-3294[])(3439:資料-insert-3439[(3554:資料-insert-3554[])(3555:नमस्ते-insert-3555[])])])(3515:🚀-insert-3515[])])])(3424:Café-insert-3424[])])(2749:مرحبا-insert-2749[])])])(2686:नमस्ते-insert-2686[(3431:Café-insert-3431[(3556:東京-insert-3556[])(3571:資料-insert-3571[])(3584:edit\\:\\[\\]\\(\\)\\\\-insert-3584[])])])])(3481:東京-insert-3481[(3233:مرحبا-insert-3233[(3303:資料-insert-3303[(2815:naïve-insert-2815[(2822:edit\\:\\[\\]\\(\\)\\\\-insert-2822[(3456:東京-insert-3456[(3414:🚀-insert-3414[(2613:edit\\:\\[\\]\\(\\)\\\\-insert-2613[(2377:🚀-insert-2377[])])])])(3308:🚀-insert-3308[])])])])(3540:東京-insert-3540[(3455:مرحبا-insert-3455[(2813:資料-insert-2813[(3168:مرحبا-insert-3168[(2534:資料-insert-2534[(3177:資料-insert-3177[(2656:مرحبا-insert-2656[(3305:資料-insert-3305[])(3482:naïve-insert-3482[(2969:नमस्ते-insert-2969[(2204:مرحبا-insert-2204[(3347:資料-insert-3347[])(2741:東京-insert-2741[(1462:مرحبا-insert-1462[(2961:Café-insert-2961[(3354:edit\\:\\[\\]\\(\\)\\\\-insert-3354[(3542:Café-insert-3542[])])])(3270:資料-insert-3270[])])(2843:資料-insert-2843[(3495:مرحبا-insert-3495[])])])(3212:東京-insert-3212[(3428:مرحبا-insert-3428[(3182:naïve-insert-3182[])(2740:नमस्ते-insert-2740[(3504:edit\\:\\[\\]\\(\\)\\\\-insert-3504[(1629:नमस्ते-insert-1629[(3375:edit\\:\\[\\]\\(\\)\\\\-insert-3375[(3574:edit\\:\\[\\]\\(\\)\\\\-insert-3574[])(3520:東京-insert-3520[])])])])(3188:🚀-insert-3188[])(3525:नमस्ते-insert-3525[])])])(3380:edit\\:\\[\\]\\(\\)\\\\-insert-3380[(3528:東京-insert-3528[])])(3086:東京-insert-3086[])])(3566:東京-insert-3566[])])])])(2614:Café-insert-2614[(3176:नमस्ते-insert-3176[(2545:Café-insert-2545[(3524:Café-insert-3524[(3532:नमस्ते-insert-3532[])])(3565:東京-insert-3565[])(2096:naïve-insert-2096[])])(3422:資料-insert-3422[])])(3372:مرحبا-insert-3372[(2917:東京-insert-2917[])])])])])])])])])])])])])])(3320:नमस्ते-insert-3320[(3464:naïve-insert-3464[])(3446:مرحبا-insert-3446[(3484:edit\\:\\[\\]\\(\\)\\\\-insert-3484[])(2825:नमस्ते-insert-2825[(1639:مرحبا-insert-1639[(3535:नमस्ते-insert-3535[])])(3295:naïve-insert-3295[])(3586:🚀-insert-3586[])])])])])])])])])(3097:edit\\:\\[\\]\\(\\)\\\\-insert-3097[(3231:naïve-insert-3231[])(3232:naïve-insert-3232[(3494:नमस्ते-insert-3494[])])])])])])(2167:🚀-insert-2167[(2963:مرحبا-insert-2963[])(3361:नमस्ते-insert-3361[])(3026:東京-insert-3026[(3242:Café-insert-3242[(3523:नमस्ते-insert-3523[])(2933:edit\\:\\[\\]\\(\\)\\\\-insert-2933[(3459:edit\\:\\[\\]\\(\\)\\\\-insert-3459[])(1832:edit\\:\\[\\]\\(\\)\\\\-insert-1832[])])])])])])])])","canonicalBytes":7775,"canonicalSha256":"40e55287bfd9486ef258602766e7c839e2ad77ba7f52b843117607132a6fd0c4","counters":{"boundary-crossings":0,"child-insertions":6922,"child-list-allocations":3590,"child-removals":6666,"deletes":3333,"final-nodes":257,"initial-nodes":256,"inserts":3334,"label-values":3590,"node-object-allocations":3590,"operations":10000,"parent-writes":10255,"reparents":3333,"traversal-nodes":257},"identity":{"orderedChildrenRetained":true,"parentChildLinksValid":true,"reachableNodes":257,"rootId":0,"uniqueNodeIds":257},"schemaVersion":1}
